,year,date,title,author,bibcode,pub,cite_count
274,2023,2023-05-01 00:00:00+00:00,Spectroscopic and photometric study of the pulsating eclipsing binary HIP 28271,"Chen, T",2023NewA..10001975C,New Astronomy,3
275,2023,2023-05-01 00:00:00+00:00,Discovery of a substellar companion in the TESS light curve of the δ Scuti/γ Doradus hybrid pulsator HD 31221,"Kalman, S",2023A&A...673L..14K,Astronomy and Astrophysics,2
276,2023,2023-05-01 00:00:00+00:00,Contemporaneous Observations of Hα Luminosities and Photometric Amplitudes for M Dwarfs,"Garcia Soto, A",2023AJ....165..192G,The Astronomical Journal,3
277,2023,2023-05-01 00:00:00+00:00,Searching for Compact Object Candidates from LAMOST Time-domain Survey of Four K2 Plates,"Qi, S",2023AJ....165..187Q,The Astronomical Journal,1
278,2023,2023-04-01 00:00:00+00:00,Evolutionary and Observational Properties of Red Giant Acoustic Glitch Signatures,"Saunders, D",2023ApJ...947...22S,The Astrophysical Journal,1
279,2023,2023-04-01 00:00:00+00:00,"The study on transiting systems HAT-P-13, HAT-P-16, and WASP-32 through combining ground-based and TESS photometry","Sun, L",2023MNRAS.520.1642S,Monthly Notices of the Royal Astronomical Society,0
280,2023,2023-04-01 00:00:00+00:00,Direct imaging and astrometric detection of a gas giant planet orbiting an accelerating star,"Currie, T",2023Sci...380..198C,Science,22
281,2023,2023-04-01 00:00:00+00:00,Serendipitous discovery of the magnetic cataclysmic variable SRGE J075818−612027,"Ok, S",2023A&A...672A.188O,Astronomy and Astrophysics,1
282,2023,2023-04-01 00:00:00+00:00,Direct imaging discovery of a super-Jovian around the young Sun-like star AF Leporis,"De Rosa, R",2023A&A...672A..94D,Astronomy and Astrophysics,17
283,2023,2023-04-01 00:00:00+00:00,Constraining Young Hot Jupiter Occurrence Rate in Stellar Associations Using 2-min Cadence TESS Data,"Fang, Y",2023Univ....9..192F,Universe,1
284,2023,2023-04-01 00:00:00+00:00,TOI-836: A super-Earth and mini-Neptune transiting a nearby K-dwarf,"Hawthorn, F",2023MNRAS.520.3649H,Monthly Notices of the Royal Astronomical Society,7
285,2023,2023-04-01 00:00:00+00:00,Discovery of a massive giant planet with extreme density around the sub-giant star TOI-4603,"Khandelwal, A",2023A&A...672L...7K,Astronomy and Astrophysics,0
286,2023,2023-04-01 00:00:00+00:00,Tilted discs in six poorly studied cataclysmic variables,"Stefanov, S",2023MNRAS.520.3355S,Monthly Notices of the Royal Astronomical Society,3
287,2023,2023-04-01 00:00:00+00:00,Search for DA White Dwarf Binary Candidates from LAMOST DR7,"Yan, H",2023Univ....9..177Y,Universe,0
288,2023,2023-04-01 00:00:00+00:00,The K2 and TESS Synergy. II. Revisiting 26 Systems in the TESS Primary Mission,"Thygesen, E",2023AJ....165..155T,The Astronomical Journal,1
289,2023,2023-04-01 00:00:00+00:00,Localizing Sources of Variability in Crowded TESS Photometry,"Higgins, M",2023AJ....165..141H,The Astronomical Journal,17
290,2023,2023-04-01 00:00:00+00:00,The IACOB project. VIII. Searching for empirical signatures of binarity in fast-rotating O-type stars,"Britavskiy, N",2023A&A...672A..22B,Astronomy and Astrophysics,4
291,2023,2023-04-01 00:00:00+00:00,Spectroscopically Identified Cataclysmic Variables from the LAMOST Survey. II. Period Estimates,"Hou, W",2023AJ....165..148H,The Astronomical Journal,4
292,2023,2023-04-01 00:00:00+00:00,A super-Earth and a mini-Neptune near the 2:1 MMR straddling the radius valley around the nearby mid-M dwarf TOI-2096,"Pozuelos, F",2023A&A...672A..70P,Astronomy and Astrophysics,8
293,2023,2023-04-01 00:00:00+00:00,TOI-2525 b and c: A Pair of Massive Warm Giant Planets with Strong Transit Timing Variations Revealed by TESS,"Trifonov, T",2023AJ....165..179T,The Astronomical Journal,7
294,2023,2023-04-01 00:00:00+00:00,TOI-1695 b: A Water World Orbiting an Early-M Dwarf in the Planet Radius Valley,"Cherubim, C",2023AJ....165..167C,The Astronomical Journal,10
295,2023,2023-04-01 00:00:00+00:00,"Rotation Periods, Inclinations, and Obliquities of Cool Stars Hosting Directly Imaged Substellar Companions: Spin-Orbit Misalignments Are Common","Bowler, B",2023AJ....165..164B,The Astronomical Journal,10
296,2023,2023-04-01 00:00:00+00:00,Understanding and predicting cadence effects in the characterization of exoplanet transits,"Hernandez Camero, J",2023MNRAS.520.4103H,Monthly Notices of the Royal Astronomical Society,3
297,2023,2023-03-01 00:00:00+00:00,Characterization of a Set of Small Planets with TESS and CHEOPS and an Analysis of Photometric Performance,"Oddo, D",2023AJ....165..134O,The Astronomical Journal,3
298,2023,2023-03-01 00:00:00+00:00,Tidally perturbed gravity-mode pulsations in a sample of close eclipsing binaries,"Van Reeth, T",2023A&A...671A.121V,Astronomy and Astrophysics,4
299,2023,2023-03-01 00:00:00+00:00,Limb darkening measurements from TESS and Kepler light curves of transiting exoplanets,"Maxted, P",2023MNRAS.519.3723M,Monthly Notices of the Royal Astronomical Society,6
300,2023,2023-03-01 00:00:00+00:00,Apsidal motion and absolute parameters of GV Nor and V881 Sco based on mid-resolution spectroscopy and TESS photometry,"Surgit, D",2023MNRAS.519.4699S,Monthly Notices of the Royal Astronomical Society,0
301,2023,2023-03-01 00:00:00+00:00,Red horizontal branch stars: An asteroseismic perspective,"Matteuzzi, M",2023A&A...671A..53M,Astronomy and Astrophysics,3
302,2023,2023-03-01 00:00:00+00:00,Search for planets around stars with wide brown dwarfs,"Subjak, J",2023A&A...671A..10S,Astronomy and Astrophysics,0
303,2023,2023-03-01 00:00:00+00:00,Comparative study of nearly‑grazing and fully‑grazing exoplanet system parameters derived with TESS and ground‑based instruments,"Alexoudi, X",2023AN....34420075A,Astronomische Nachrichten,0
304,2023,2023-03-01 00:00:00+00:00,The TESS Grand Unified Hot Jupiter Survey. II. Twenty New Giant Planets,"Yee, S",2023ApJS..265....1Y,The Astrophysical Journal Supplement Series,9
305,2023,2023-03-01 00:00:00+00:00,Rotational modulation in A and F stars: magnetic stellar spots or convective core rotation?,"Henriksen, A",2023MNRAS.520..216H,Monthly Notices of the Royal Astronomical Society,5
306,2023,2023-03-01 00:00:00+00:00,A deep radius valley revealed by Kepler short cadence observations,"Ho, C",2023MNRAS.519.4056H,Monthly Notices of the Royal Astronomical Society,20
307,2023,2023-03-01 00:00:00+00:00,"A puffy polar planet. The low density, hot Jupiter TOI-640 b is on a polar orbit","Knudstrup, E",2023A&A...671A.164K,Astronomy and Astrophysics,2
308,2023,2023-03-01 00:00:00+00:00,V907 Sco Switched to the Eclipsing Mode Again,"Zasche, P",2023AJ....165...81Z,The Astronomical Journal,2
309,2023,2023-03-01 00:00:00+00:00,"Radio transients and variables in the tenth Deeper, Wider, Faster observing run","Dobie, D",2023MNRAS.519.4684D,Monthly Notices of the Royal Astronomical Society,4
310,2023,2023-03-01 00:00:00+00:00,TESS Asteroseismic Analysis of HD 76920: The Giant Star Hosting an Extremely Eccentric Exoplanet,"Jiang, C",2023ApJ...945...20J,The Astrophysical Journal,2
311,2023,2023-03-01 00:00:00+00:00,A Study of the Pulsation Properties of 57 Non-Blazhko Ab-type RR Lyrae Stars with Homogeneous Metallicities from the LAMOST-Kepler/K2 Survey,"Zong, P",2023ApJ...945...18Z,The Astrophysical Journal,1
312,2023,2023-03-01 00:00:00+00:00,Improved radius determinations for the transiting brown dwarf population in the era of Gaia and TESS,"Carmichael, T",2023MNRAS.519.5177C,Monthly Notices of the Royal Astronomical Society,6
313,2023,2023-03-01 00:00:00+00:00,Radial velocity confirmation of a hot super-Neptune discovered by TESS with a warm Saturn-mass companion,"Knudstrup, E",2023MNRAS.519.5637K,Monthly Notices of the Royal Astronomical Society,1
314,2023,2023-03-01 00:00:00+00:00,TOI-5205b: A Short-period Jovian Planet Transiting a Mid-M Dwarf,"Kanodia, S",2023AJ....165..120K,The Astronomical Journal,16
315,2023,2023-03-01 00:00:00+00:00,TESS Observations of the Pleiades Cluster: A Nursery for δ Scuti Stars,"Bedding, T",2023ApJ...946L..10B,The Astrophysical Journal,11
316,2023,2023-03-01 00:00:00+00:00,"TOI-561 b: A Low-density Ultra-short-period ""Rocky"" Planet around a Metal-poor Star","Brinkman, C",2023AJ....165...88B,The Astronomical Journal,11
317,2023,2023-03-01 00:00:00+00:00,Extending optical flare models to the UV: results from comparing of TESS and GALEX flare observations for M Dwarfs,"Jackman, J",2023MNRAS.519.3564J,Monthly Notices of the Royal Astronomical Society,13
318,2023,2023-02-01 00:00:00+00:00,TESS Giants Transiting Giants. III. An Eccentric Warm Jupiter Supports a Period-Eccentricity Relation for Giant Planets Transiting Evolved Stars,"Grunblatt, S",2023AJ....165...44G,The Astronomical Journal,6
319,2023,2023-02-01 00:00:00+00:00,Kepler K2 and TESS Observations of Two Magnetic Cataclysmic Variables: The New Asynchronous Polar SDSS J084617.11+245344.1 and Paloma,"Littlefield, C",2023AJ....165...43L,The Astronomical Journal,8
320,2023,2023-02-01 00:00:00+00:00,How noise thresholds affect the information content of stellar flare sequences,"Rivera, E",2023A&A...670A.143R,Astronomy and Astrophysics,1
321,2023,2023-02-01 00:00:00+00:00,Outer disc edge: properties of low-frequency aperiodic variability in ultracompact interacting binaries,"Veresvarska, M",2023MNRAS.518.5576V,Monthly Notices of the Royal Astronomical Society,0
322,2023,2023-02-01 00:00:00+00:00,First detailed study of two eccentric eclipsing binaries: TYC 5378-1590-1 and TYC 8378-252-1,"Zasche, P",2023A&A...670A..39Z,Astronomy and Astrophysics,0
323,2023,2023-02-01 00:00:00+00:00,"Astrometric Accelerations as Dynamical Beacons: Discovery and Characterization of HIP 21152 B, the First T-dwarf Companion in the Hyades","Franson, K",2023AJ....165...39F,The Astronomical Journal,17
324,2023,2023-02-01 00:00:00+00:00,A Study of Stellar Spins in 15 Open Clusters,"Healy, B",2023ApJ...944...39H,The Astrophysical Journal,3
325,2023,2023-02-01 00:00:00+00:00,Candidate triple-star system with ellipsoidal components detected in Vulpecula through TESS photometry,"Conzo, G",2023OEJV..235....1C,Open European Journal on Variable Stars,0
326,2023,2023-02-01 00:00:00+00:00,SDSS J134441.83+204408.3: A Highly Asynchronous Short-period Magnetic Cataclysmic Variable with a 56 MG Field Strength,"Littlefield, C",2023ApJ...943L..24L,The Astrophysical Journal,5
327,2023,2023-02-01 00:00:00+00:00,"HD 213258: A new rapidly oscillating, super slowly rotating, strongly magnetic Ap star in a spectroscopic binary","Mathys, G",2023A&A...670A..72M,Astronomy and Astrophysics,4
328,2023,2023-02-01 00:00:00+00:00,Constraining the Densities of the Three Kepler-289 Planets with Transit Timing Variations,"Greklek-McKeon, M",2023AJ....165...48G,The Astronomical Journal,4
329,2023,2023-02-01 00:00:00+00:00,Modeling photometric variations due to a global inhomogeneity on an obliquely rotating star: Application to light curves of white dwarfs,"Suto, Y",2023PASJ...75..103S,Publications of the Astronomical Society of Japan,1
330,2023,2023-02-01 00:00:00+00:00,"A Second Earth-sized Planet in the Habitable Zone of the M Dwarf, TOI-700","Gilbert, E",2023ApJ...944L..35G,The Astrophysical Journal,10
331,2023,2023-02-01 00:00:00+00:00,L 363-38 b: A planet newly discovered with ESPRESSO orbiting a nearby M dwarf star,"Sartori, L",2023A&A...670A..42S,Astronomy and Astrophysics,0
332,2023,2023-02-01 00:00:00+00:00,Lithium Abundances in Giants as a Function of Stellar Mass: Evidence for He Flash as the Source of Li Enhancement in Low-mass Giants,"Mallick, A",2023ApJ...944L...5M,The Astrophysical Journal,5
333,2023,2023-02-01 00:00:00+00:00,DIAmante TESS AutoRegressive Planet Search (DTARPS): II. Hundreds of New TESS Candidate Exoplanets,"Melton, E",2023arXiv230206724M,arXiv e-prints,3
334,2023,2023-02-01 00:00:00+00:00,An In-Depth Look at TOI-3884b: a Super-Neptune Transiting a M4 Dwarf with Persistent Star Spot Crossings,"Libby-Roberts, J",2023arXiv230204757L,arXiv e-prints,2
335,2023,2023-02-01 00:00:00+00:00,FluxCT: A Web Tool for Identifying Contaminating Flux in Kepler and TESS Target Pixel Files,"Schonhut-Stasik, J",2023RNAAS...7...18S,Research Notes of the American Astronomical Society,4
336,2023,2023-02-01 00:00:00+00:00,New compact hierarchical triple system candidates identified using Gaia DR3,"Czavalinga, D",2023A&A...670A..75C,Astronomy and Astrophysics,9
337,2023,2023-02-01 00:00:00+00:00,DIAmante TESS AutoRegressive Planet Search (DTARPS): I. Analysis of 0.9 Million Light Curves,"Melton, E",2023arXiv230206700M,arXiv e-prints,2
338,2023,2023-02-01 00:00:00+00:00,The Orbital Architecture of Qatar-6: A Fully Aligned Three-body System?,"Rice, M",2023AJ....165...65R,The Astronomical Journal,10
339,2023,2023-02-01 00:00:00+00:00,Complex network view for $\delta$ Scuti stars,"Ziaali, E",2023arXiv230206904Z,arXiv e-prints,0
340,2023,2023-02-01 00:00:00+00:00,Constraints on Stellar Flare Energy Ratios in the NUV and Optical from a Multiwavelength Study of GALEX and Kepler Flare Stars,"Brasseur, C",2023ApJ...944....5B,The Astrophysical Journal,15
341,2023,2023-02-01 00:00:00+00:00,A sub-Neptune planet around TOI-1695 discovered and characterized with SPIRou and TESS,"Kiefer, F",2023A&A...670A.136K,Astronomy and Astrophysics,4
342,2023,2023-02-01 00:00:00+00:00,NEID Reveals That the Young Warm Neptune TOI-2076 b Has a Low Obliquity,"Frazier, R",2023ApJ...944L..41F,The Astrophysical Journal,4
343,2023,2023-02-01 00:00:00+00:00,Kepler-102: Masses and Compositions for a Super-Earth and Sub-Neptune Orbiting an Active Star,"Brinkman, C",2023AJ....165...74B,The Astronomical Journal,3
344,2023,2023-01-01 00:00:00+00:00,Star Classification: A Deep Learning Approach for Identifying Binary and Exoplanet Stars,"Kumar, A",2023arXiv230113115K,arXiv e-prints,0
345,2023,2023-01-01 00:00:00+00:00,Light curves analysis with Lightkurve,"Mota Crispim, J",2023BoSAB..34..139M,Boletim da Sociedade Astronomica Brasileira,0
346,2023,2023-01-01 00:00:00+00:00,The effect of stellar contamination on low-resolution transmission spectroscopy: needs identified by NASA's Exoplanet Exploration Program Study Analysis Group 21,"Rackham, B",2023RASTI...2..148R,RAS Techniques and Instruments,28
347,2023,2023-01-01 00:00:00+00:00,Photometric Properties and Stellar Parameters of the Rapidly Rotating Magnetic Early-B Star HD 345439,"Shen, D",2023RAA....23a5002S,Research in Astronomy and Astrophysics,3
348,2023,2023-01-01 00:00:00+00:00,Exploring short-term optical variability of blazars using TESS,"Pininti, V",2023MNRAS.518.1459P,Monthly Notices of the Royal Astronomical Society,9
349,2023,2023-01-01 00:00:00+00:00,Detection of Quasiperiodic Oscillations in the Blazar S4 0954+658 with TESS,"Kishore, S",2023ApJ...943...53K,The Astrophysical Journal,7
350,2023,2023-01-01 00:00:00+00:00,TESS uncloaks the secondaries in hydrogen-deficient binaries,"Jeffery, C",2023MNRAS.518L..75J,Monthly Notices of the Royal Astronomical Society,1
351,2023,2023-01-01 00:00:00+00:00,20 s Cadence TESS Photometry of HR 8799,"Sepulveda, A",2023RNAAS...7....2S,Research Notes of the American Astronomical Society,2
352,2023,2023-01-01 00:00:00+00:00,Hierarchical Classification of Variable Stars Using Deep Convolutional Neural Networks,"Abdollahi, M",2023arXiv230108497A,arXiv e-prints,0
353,2023,2023-01-01 00:00:00+00:00,The first photometric and spectroscopic analysis of the neglected totally eclipsing contact binary NSVS 2536063,"Xia, Q",2023NewA...9801914X,New Astronomy,1
354,2023,2023-01-01 00:00:00+00:00,Catalogue of solar-like oscillators observed by TESS in 120-s and 20-s cadence,"Hatt, E",2023A&A...669A..67H,Astronomy and Astrophysics,8
355,2023,2023-01-01 00:00:00+00:00,Hidden Companions Detected by Asteroseismology. II. A Long-period Noneclipsing Binary System Revealed by Kepler and TESS,"Lyu, X",2023ApJ...943L...7L,The Astrophysical Journal,0
356,2023,2023-01-01 00:00:00+00:00,Removing biases on the density of sub-Neptunes characterised via transit timing variations. Update on the mass-radius relationship of 34 Kepler planets,"Leleu, A",2023A&A...669A.117L,Astronomy and Astrophysics,6
357,2023,2023-01-01 00:00:00+00:00,TFAW survey II: six newly validated planets and 13 planet candidates from K2,"del Ser, D",2023MNRAS.518..669D,Monthly Notices of the Royal Astronomical Society,0
358,2022,2022-12-01 00:00:00+00:00,"Meta-analysis of Photometric and Asteroseismic Measurements of Stellar Rotation Periods: The Lomb-Scargle Periodogram, Autocorrelation Function, and Wavelet and Rotational Splitting Analysis for 92 Kepler Asteroseismic Targets","Lu, Y",2022ApJ...941..175L,The Astrophysical Journal,3
359,2022,2022-12-01 00:00:00+00:00,"Pulsating hydrogen-deficient white dwarfs and pre-white dwarfs observed with TESS. V. Discovery of two new DBV pulsators, WDJ152738.4−450207.4 and WD 1708−871, and asteroseismology of the already known DBV stars PG 1351+489, EC 20058−5234, and EC 04207−4748","Corsico, A",2022A&A...668A.161C,Astronomy and Astrophysics,3
360,2022,2022-12-01 00:00:00+00:00,VarStar Detect: a Python library for the semi-automatic detection of stellar variability,"Jorge, P",2022AASP...12...13J,Advances in Astronomy and Space Physics,0
361,2022,2022-12-01 00:00:00+00:00,SPYGLASS. III. The Fornax-Horologium Association and Its Traceback History within the Austral Complex,"Kerr, R",2022ApJ...941..143K,The Astrophysical Journal,11
362,2022,2022-12-01 00:00:00+00:00,Superflares on solar-like stars. A new method for identifying the true flare sources in photometric surveys,"Vasilyev, V",2022A&A...668A.167V,Astronomy and Astrophysics,5
363,2022,2022-12-01 00:00:00+00:00,ESPRESSO observations of HE 0107−5240 and other CEMP-no stars with [Fe/H] ≤ -4.5,"Aguado, D",2022A&A...668A..86A,Astronomy and Astrophysics,12
364,2022,2022-12-01 00:00:00+00:00,Searching for Compact Objects in Binaries with Gaia DR3,"Fu, J",2022ApJ...940..126F,The Astrophysical Journal,8
365,2022,2022-12-01 00:00:00+00:00,Follow-up of Young Stars Identified with BANYAN Σ: New Low-mass Members of Nearby Moving Groups,"Stahl, A",2022ApJ...941..101S,The Astrophysical Journal,3
366,2022,2022-12-01 00:00:00+00:00,"Comprehensive listing of 156 reliable orbital periods for novae, including 49 new periods","Schaefer, B",2022MNRAS.517.3640S,Monthly Notices of the Royal Astronomical Society,12
367,2022,2022-12-01 00:00:00+00:00,Companions to Kepler giant stars: A long-period eccentric sub-stellar companion to KIC 3526061 and a stellar companion to HD 187878,"Karjalainen, M",2022A&A...668A..26K,Astronomy and Astrophysics,0
368,2022,2022-12-01 00:00:00+00:00,"Phase curve and geometric albedo of WASP-43b measured with CHEOPS, TESS, and HST WFC3/UVIS","Scandariato, G",2022A&A...668A..17S,Astronomy and Astrophysics,12
369,2022,2022-12-01 00:00:00+00:00,Fundamental effective temperature measurements for eclipsing binary stars - II. The detached F-type eclipsing binary CPD-54 810,"Miller, N",2022MNRAS.517.5129M,Monthly Notices of the Royal Astronomical Society,3
370,2022,2022-12-01 00:00:00+00:00,The Possible Tidal Demise of Kepler's First Planetary System,"Vissapragada, S",2022ApJ...941L..31V,The Astrophysical Journal,14
371,2022,2022-12-01 00:00:00+00:00,Deep and fast Solar System flybys: the controversial case of WD 0810-353,"de la Fuente Marcos, R",2022A&A...668A..14D,Astronomy and Astrophysics,3
372,2022,2022-12-01 00:00:00+00:00,HD 20329b: An ultra-short-period planet around a solar-type star found by TESS,"Murgas, F",2022A&A...668A.158M,Astronomy and Astrophysics,6
373,2022,2022-12-01 00:00:00+00:00,"TESS discovery of a super-Earth and two sub-Neptunes orbiting the bright, nearby, Sun-like star HD 22946","Cacciapuoti, L",2022A&A...668A..85C,Astronomy and Astrophysics,4
374,2022,2022-12-01 00:00:00+00:00,The nova KT Eri Is a recurrent nova with a recurrence time-scale of 40-50 yr,"Schaefer, B",2022MNRAS.517.3864S,Monthly Notices of the Royal Astronomical Society,5
375,2022,2022-12-01 00:00:00+00:00,Distance and age of the massive stellar cluster Westerlund 1 - II. The eclipsing binary W36,"Rocha, D",2022MNRAS.517.3749R,Monthly Notices of the Royal Astronomical Society,0
376,2022,2022-12-01 00:00:00+00:00,Detection of p-mode Oscillations in HD 35833 with NEID and TESS,"Gupta, A",2022AJ....164..254G,The Astronomical Journal,3
377,2022,2022-12-01 00:00:00+00:00,Establishing the accuracy of asteroseismic mass and radius estimates of giant stars - II. Revised stellar masses and radii for KIC 8430105,"Thomsen, J",2022MNRAS.517.4187T,Monthly Notices of the Royal Astronomical Society,1
378,2022,2022-12-01 00:00:00+00:00,"Fundamental parameters of barium and CH stars from asteroseismic analysis: HD 33409, HD 20084 and HD 66812","Sonamben, M",2022JApA...43...92S,Journal of Astrophysics and Astronomy,0
379,2022,2022-12-01 00:00:00+00:00,Are Am stars and hot-Jupiter planets related?,"Saffe, C",2022A&A...668A.157S,Astronomy and Astrophysics,1
380,2022,2022-11-01 00:00:00+00:00,Confirmation and characterisation of three giant planets detected by TESS from the FIES/NOT and Tull/McDonald spectrographs,"Knudstrup, E",2022A&A...667A..22K,Astronomy and Astrophysics,7
381,2022,2022-11-01 00:00:00+00:00,Short-duration accretion states of Polars as seen in TESS and ZTF data,"Duffy, C",2022MNRAS.516.3144D,Monthly Notices of the Royal Astronomical Society,0
382,2022,2022-11-01 00:00:00+00:00,"Evaluating the efficacy of sonification for signal detection in univariate, evenly sampled light curves using ASTRONIFY","Tucker Brown, J",2022MNRAS.516.5674T,Monthly Notices of the Royal Astronomical Society,5
383,2022,2022-11-01 00:00:00+00:00,Gaia-TESS synergy: improving the identification of transit candidates,"Panahi, A",2022A&A...667A..14P,Astronomy and Astrophysics,6
384,2022,2022-11-01 00:00:00+00:00,Correcting Stellar Flare Frequency Distributions Detected by TESS and Kepler,"Gao, D",2022AJ....164..213G,The Astronomical Journal,5
385,2022,2022-11-01 00:00:00+00:00,Pulse Timing Discovery of a Three-day Companion to the Hot Subdwarf BPM 36430,"Smith, B",2022ApJ...939...57S,The Astrophysical Journal,3
386,2022,2022-11-01 00:00:00+00:00,Fast time optical variability in Be/X-ray binaries. Pulsation and rotation,"Reig, P",2022A&A...667A..18R,Astronomy and Astrophysics,3
387,2022,2022-11-01 00:00:00+00:00,KIC 6951642: A confirmed Kepler γ Doradus - δ Scuti star with intermediate to fast rotation in a possible single-lined binary system,"Samadi-Ghadim, A",2022A&A...667A..60S,Astronomy and Astrophysics,1
388,2022,2022-11-01 00:00:00+00:00,Validation of TESS exoplanet candidates orbiting solar analogues in the all-sky PLATO input catalogue,"Mantovan, G",2022MNRAS.516.4432M,Monthly Notices of the Royal Astronomical Society,7
389,2022,2022-11-01 00:00:00+00:00,Discovery of a Mid-L Dwarf Companion to the L 262-74 System,"Gramaize, L",2022RNAAS...6..229G,Research Notes of the American Astronomical Society,2
390,2022,2022-11-01 00:00:00+00:00,The complex dynamical past and future of double eclipsing binary CzeV343: Misaligned orbits and period resonance,"Pejcha, O",2022A&A...667A..53P,Astronomy and Astrophysics,2
391,2022,2022-11-01 00:00:00+00:00,A Population of Dipper Stars from the Transiting Exoplanet Survey Satellite Mission,"Capistrant, B",2022ApJS..263...14C,The Astrophysical Journal Supplement Series,7
392,2022,2022-11-01 00:00:00+00:00,Planet-star interactions with precise transit timing. III. Entering the regime of dynamical tides,"Maciejewski, G",2022A&A...667A.127M,Astronomy and Astrophysics,5
393,2022,2022-11-01 00:00:00+00:00,"Kepler K2 Observations of the Faint, Understudied Polar SDSS J092122.84+203857.1","O'Brien, B",2022RNAAS...6..246O,Research Notes of the American Astronomical Society,0
394,2022,2022-11-01 00:00:00+00:00,pySYD: Automated measurements of global asteroseismic parameters,"Chontos, A",2022JOSS....7.3331C,The Journal of Open Source Software,14
395,2022,2022-11-01 00:00:00+00:00,The GAPS programme at TNG. XL. A puffy and warm Neptune-sized planet and an outer Neptune-mass candidate orbiting the solar-type star TOI-1422,"Naponiello, L",2022A&A...667A...8N,Astronomy and Astrophysics,4
396,2022,2022-11-01 00:00:00+00:00,"Radial velocity survey for planets around young stars (RVSPY). A transiting warm super-Jovian planet around HD 114082, a young star with a debris disk","Zakhozhay, O",2022A&A...667L..14Z,Astronomy and Astrophysics,5
397,2022,2022-10-01 00:00:00+00:00,Characterization of the eclipsing post-common-envelope binary TIC 60040774,"Priyatikanto, R",2022MNRAS.516.1183P,Monthly Notices of the Royal Astronomical Society,0
398,2022,2022-10-01 00:00:00+00:00,KIC 10417986: Spectroscopic Confirmation of the Nature of the Binary System with a δ Scuti Component,"Feng, G",2022RAA....22j5005F,Research in Astronomy and Astrophysics,0
399,2022,2022-10-01 00:00:00+00:00,Searching for stellar flares from low-mass stars using ASKAP and TESS,"Rigney, J",2022MNRAS.516..540R,Monthly Notices of the Royal Astronomical Society,6
400,2022,2022-10-01 00:00:00+00:00,A hot sub-Neptune in the desert and a temperate super-Earth around faint M dwarfs. Color validation of TOI-4479b and TOI-2081b,"Esparza-Borges, E",2022A&A...666A..10E,Astronomy and Astrophysics,4
401,2022,2022-10-01 00:00:00+00:00,KIC 3440495: A Rapidly Rotating δ Scuti-γ Doradus Hybrid Pulsator in a Binary System,"Ma, S",2022ApJ...937...80M,The Astrophysical Journal,3
402,2022,2022-10-01 00:00:00+00:00,Constraining the overcontact phase in massive binary evolution. II. Period stability of known O+O overcontact systems,"Abdul-Masih, M",2022A&A...666A..18A,Astronomy and Astrophysics,5
403,2022,2022-10-01 00:00:00+00:00,Revisiting bright δ Scuti stars and their period-luminosity relation with TESS and Gaia DR3,"Barac, N",2022MNRAS.516.2080B,Monthly Notices of the Royal Astronomical Society,17
