,year,date,title,author,bibcode,pub,cite_count
268,2022,2022-08-01 00:00:00+00:00,TOI-3714 b and TOI-3629 b: Two Gas Giants Transiting M Dwarfs Confirmed with the Habitable-zone Planet Finder and NEID,"Canas, C",2022AJ....164...50C,The Astronomical Journal,14
269,2022,2022-08-01 00:00:00+00:00,Minima Epoches of BF Draconis Observed by the TESS Satellite,"Schmutz, W",2022RNAAS...6..173S,Research Notes of the American Astronomical Society,0
270,2022,2022-08-01 00:00:00+00:00,An investigation of the magnetic activity of HD 134319 based on TESS photometry and ground-based spectroscopy,"Xu, F",2022MNRAS.514.2958X,Monthly Notices of the Royal Astronomical Society,0
271,2022,2022-08-01 00:00:00+00:00,Uncovering the true periods of the young sub-Neptunes orbiting TOI-2076,"Osborn, H",2022A&A...664A.156O,Astronomy and Astrophysics,13
272,2022,2022-08-01 00:00:00+00:00,Data processing pipeline for the Earth 2.0 mission,"Yao, X",2022SPIE12180E..4EY,"Space Telescopes and Instrumentation 2022: Optical, Infrared, and Millimeter Wave",0
273,2022,2022-08-01 00:00:00+00:00,Identifying quiescent compact objects in massive Galactic single-lined spectroscopic binaries,"Mahy, L",2022A&A...664A.159M,Astronomy and Astrophysics,15
274,2022,2022-08-01 00:00:00+00:00,Convolutional Neural Networks for Searching Superflares from Pixel-level Data of the Transiting Exoplanet Survey Satellite,"Tu, Z",2022ApJ...935...90T,The Astrophysical Journal,0
275,2022,2022-07-01 00:00:00+00:00,"TOI-2046b, TOI-1181b, and TOI-1516b, three new hot Jupiters from TESS: planets orbiting a young star, a subgiant, and a normal star","Kabath, P",2022MNRAS.513.5955K,Monthly Notices of the Royal Astronomical Society,3
276,2022,2022-07-01 00:00:00+00:00,Searching for flaring star-planet interactions in AU Mic TESS observations,"Ilin, E",2022MNRAS.513.4579I,Monthly Notices of the Royal Astronomical Society,5
277,2022,2022-07-01 00:00:00+00:00,Transit Timing Variations for AU Microscopii b and c,"Wittrock, J",2022AJ....164...27W,The Astronomical Journal,7
278,2022,2022-07-01 00:00:00+00:00,Fundamental effective temperature measurements for eclipsing binary stars - III. SPIRou near-infrared spectroscopy and CHEOPS photometry of the benchmark G0V star EBLM J0113+31,"Maxted, P",2022MNRAS.513.6042M,Monthly Notices of the Royal Astronomical Society,6
279,2022,2022-07-01 00:00:00+00:00,KIC 5768203: A δ Sct Pulsator Modulated by Rotation and Spots,"Ma, S",2022AJ....164...22M,The Astronomical Journal,1
280,2022,2022-07-01 00:00:00+00:00,Exoplanet detection using machine learning,"Malik, A",2022MNRAS.513.5505M,Monthly Notices of the Royal Astronomical Society,12
281,2022,2022-07-01 00:00:00+00:00,The CARMENES search for exoplanets around M dwarfs. Benchmarking the impact of activity in high-precision radial velocity measurements,"Jeffers, S",2022A&A...663A..27J,Astronomy and Astrophysics,14
282,2022,2022-07-01 00:00:00+00:00,The eclipsing binary systems with δ Scuti component - II. AB Cas,"Miszuda, A",2022MNRAS.514..622M,Monthly Notices of the Royal Astronomical Society,6
283,2022,2022-07-01 00:00:00+00:00,"Vetting the ""Lobster"" Diagram: Searching for Unseen Companions in Wide Binaries Using NASA Space Exoplanet Missions","Hartman, Z",2022ApJ...934...72H,The Astrophysical Journal,3
284,2022,2022-07-01 00:00:00+00:00,"The Transmission Spectrum of WASP-17 b From the Optical to the Near-infrared Wavelengths: Combining STIS, WFC3, and IRAC Data Sets","Saba, A",2022AJ....164....2S,The Astronomical Journal,9
285,2022,2022-07-01 00:00:00+00:00,"The CARMENES search for exoplanets around M dwarfs. Rotational variation in activity indicators of Ross 318, YZ CMi, TYC 3529-1437-1, and EV Lac","Schofer, P",2022A&A...663A..68S,Astronomy and Astrophysics,5
286,2022,2022-07-01 00:00:00+00:00,The Visual Survey Group: A Decade of Hunting Exoplanets and Unusual Stellar Events with Space-based Telescopes,"Kristiansen, M",2022PASP..134g4401K,Publications of the Astronomical Society of the Pacific,9
287,2022,2022-07-01 00:00:00+00:00,A Search for Exoplanets in Open Clusters and Young Associations based on TESS Objects of Interest,"Sun, Q",2022RAA....22g5008S,Research in Astronomy and Astrophysics,4
288,2022,2022-07-01 00:00:00+00:00,Unbiasing the density of TTV-characterised sub-Neptunes: Update of the mass-radius relationship of 34 Kepler planets,"Leleu, A",2022arXiv220707456L,arXiv e-prints,0
289,2022,2022-07-01 00:00:00+00:00,ALMA Images the Eccentric HD 53143 Debris Disk,"MacGregor, M",2022ApJ...933L...1M,The Astrophysical Journal,5
290,2022,2022-07-01 00:00:00+00:00,A Long-period Pre-ELM System Discovered from the LAMOST Medium-resolution Survey,"Zhang, Z",2022ApJ...933..193Z,The Astrophysical Journal,5
291,2022,2022-07-01 00:00:00+00:00,Weak evidence for variable occultation depth of 55 Cnc e with TESS,"Meier Valdes, E",2022A&A...663A..95M,Astronomy and Astrophysics,4
292,2022,2022-07-01 00:00:00+00:00,The Discovery of a Planetary Companion Interior to Hot Jupiter WASP-132 b,"Hord, B",2022AJ....164...13H,The Astronomical Journal,9
293,2022,2022-07-01 00:00:00+00:00,"LAMOST J045019.27 + 394758.7, with peculiar abundances of N, Na, V, Zn, is possibly a Sculptor dwarf galaxy escapee","Purandardas, M",2022MNRAS.513.4696P,Monthly Notices of the Royal Astronomical Society,0
294,2022,2022-07-01 00:00:00+00:00,Llamaradas Estelares: Modeling the Morphology of White-light Flares,"Tovar Mendoza, G",2022AJ....164...17M,The Astronomical Journal,4
295,2022,2022-07-01 00:00:00+00:00,High-contrast imaging of HD 29992 and HD 196385 with GPI,"Garcia, L",2022arXiv220707435G,arXiv e-prints,0
296,2022,2022-07-01 00:00:00+00:00,The detection of transiting exoplanets by Gaia,"Panahi, A",2022A&A...663A.101P,Astronomy and Astrophysics,10
297,2022,2022-06-01 00:00:00+00:00,Assessing the Transiting Exoplanet Survey Satellite's Yield of Rocky Planets Around Nearby M Dwarfs,"Brady, M",2022AJ....163..255B,The Astronomical Journal,9
298,2022,2022-06-01 00:00:00+00:00,Search for Planets in Hot Jupiter Systems with Multi-Sector TESS Photometry. II. Constraints on Planetary Companions in 12 Systems,"Maciejewski, G",2022AcA....72....1M,Acta Astronomica,2
299,2022,2022-06-01 00:00:00+00:00,A Mini-Neptune from TESS and CHEOPS Around the 120 Myr Old AB Dor Member HIP 94235,"Zhou, G",2022AJ....163..289Z,The Astronomical Journal,7
300,2022,2022-06-01 00:00:00+00:00,TOI-1268b: The youngest hot Saturn-mass transiting exoplanet,"Subjak, J",2022A&A...662A.107S,Astronomy and Astrophysics,5
301,2022,2022-06-01 00:00:00+00:00,Hitting a New Low: The Unique 28 hr Cessation of Accretion in the TESS Light Curve of YY Dra (DO Dra),"Hill, K",2022AJ....163..246H,The Astronomical Journal,7
302,2022,2022-06-01 00:00:00+00:00,fBLS - a fast-folding BLS algorithm,"Shahaf, S",2022MNRAS.513.2732S,Monthly Notices of the Royal Astronomical Society,1
303,2022,2022-06-01 00:00:00+00:00,TOI-1696 and TOI-2136: Constraining the Masses of Two Mini-Neptunes with the Habitable-Zone Planet Finder,"Beard, C",2022AJ....163..286B,The Astronomical Journal,2
304,2022,2022-06-01 00:00:00+00:00,Optical microflares in LS I +61 303 and the search for their multiwavelength counterpart,"Mestre, E",2022A&A...662A..27M,Astronomy and Astrophysics,0
305,2022,2022-06-01 00:00:00+00:00,Pulsating hydrogen-deficient white dwarfs and pre-white dwarfs observed with TESS - IV. Discovery of two new GW Vir stars: TIC 0403800675 and TIC 1989122424,"Uzundag, M",2022MNRAS.513.2285U,Monthly Notices of the Royal Astronomical Society,2
306,2022,2022-06-01 00:00:00+00:00,The NASA GSFC TESS Full Frame Image Light Curve Data Set,"Powell, B",2022RNAAS...6..111P,Research Notes of the American Astronomical Society,5
307,2022,2022-06-01 00:00:00+00:00,XMM-Newton and TESS observations of the highly variable polar V496 UMa,"Ok, S",2022A&A...662A.116O,Astronomy and Astrophysics,1
308,2022,2022-06-01 00:00:00+00:00,The unpopular Package: A Data-driven Approach to Detrending TESS Full-frame Image Light Curves,"Hattori, S",2022AJ....163..284H,The Astronomical Journal,19
309,2022,2022-06-01 00:00:00+00:00,The near-core rotation of HD 112429. A γ Doradus star with TESS photometry and legacy spectroscopy,"Van Reeth, T",2022A&A...662A..58V,Astronomy and Astrophysics,3
310,2022,2022-06-01 00:00:00+00:00,Transient two-pole accretion in the polar V496 UMa,"Kennedy, M",2022MNRAS.513.2930K,Monthly Notices of the Royal Astronomical Society,1
311,2022,2022-06-01 00:00:00+00:00,Detection of period-spacing patterns due to the gravity modes of rotating dwarfs in the TESS southern continuous viewing zone,"Garcia, S",2022A&A...662A..82G,Astronomy and Astrophysics,9
312,2022,2022-06-01 00:00:00+00:00,The TESS-Keck Survey. XI. Mass Measurements for Four Transiting Sub-Neptunes Orbiting K Dwarf TOI-1246,"Turtelboom, E",2022AJ....163..293T,The Astronomical Journal,4
313,2022,2022-05-01 00:00:00+00:00,TOI-1670 b and c: An Inner Sub-Neptune with an Outer Warm Jupiter Unlikely to Have Originated from High-eccentricity Migration,"Tran, Q",2022AJ....163..225T,The Astronomical Journal,4
314,2022,2022-05-01 00:00:00+00:00,Kepler Pixel Project: Background RR Lyrae Stars in the Primary Kepler Mission Field of View,"Forro, A",2022ApJS..260...20F,The Astrophysical Journal Supplement Series,2
315,2022,2022-05-01 00:00:00+00:00,TESS asteroseismology of the Kepler red giants,"Stello, D",2022MNRAS.512.1677S,Monthly Notices of the Royal Astronomical Society,24
316,2022,2022-05-01 00:00:00+00:00,"Rotation Distributions around the Kraft Break with TESS and Kepler: The Influences of Age, Metallicity, and Binarity","Avallone, E",2022ApJ...930....7A,The Astrophysical Journal,13
317,2022,2022-05-01 00:00:00+00:00,Alleviating the transit timing variation bias in transit surveys. II. RIVERS: Twin resonant Earth-sized planets around Kepler-1972 recovered from a Kepler false positive,"Leleu, A",2022A&A...661A.141L,Astronomy and Astrophysics,3
318,2022,2022-05-01 00:00:00+00:00,WASP-35 and HAT-P-30/WASP-51: Reanalysis using TESS and Ground-based Transit Photometry,"Bai, L",2022AJ....163..208B,The Astronomical Journal,1
319,2022,2022-05-01 00:00:00+00:00,Classifying Be Star Variability With TESS. I. The Southern Ecliptic,"Labadie-Bartz, J",2022AJ....163..226L,The Astronomical Journal,9
320,2022,2022-05-01 00:00:00+00:00,"Discovery of extreme, roughly daily superflares on the recurrent nova V2487 Oph","Schaefer, B",2022MNRAS.512.1924S,Monthly Notices of the Royal Astronomical Society,5
321,2022,2022-05-01 00:00:00+00:00,A comprehensive analysis of WASP-17b's transmission spectrum from space-based observations,"Alderson, L",2022MNRAS.512.4185A,Monthly Notices of the Royal Astronomical Society,7
322,2022,2022-05-01 00:00:00+00:00,Identification of three cataclysmic variables detected by the ART-XC and eROSITA telescopes on board the SRG during the all-sky X-ray survey,"Zaznobin, I",2022A&A...661A..39Z,Astronomy and Astrophysics,5
323,2022,2022-05-01 00:00:00+00:00,Pryngles: PlanetaRY spaNGLES,"Zuluaga, J",2022ascl.soft05016Z,Astrophysics Source Code Library,0
324,2022,2022-05-01 00:00:00+00:00,The puzzling story of flare inactive ultra fast rotating M dwarfs - I. Exploring their magnetic fields,"Doyle, L",2022MNRAS.512..979D,Monthly Notices of the Royal Astronomical Society,3
325,2022,2022-05-01 00:00:00+00:00,Revisiting BD-06 1339b: A Likely False Positive Caused by Stellar Activity,"Simpson, E",2022AJ....163..215S,The Astronomical Journal,5
326,2022,2022-05-01 00:00:00+00:00,A statistical primer on exoplanet detection methods,"Giertych, N",2022arXiv220510417G,arXiv e-prints,0
327,2022,2022-05-01 00:00:00+00:00,Llamaradas Estelares: Modeling the Morphology of White-Light Flares,"Tovar Mendoza, G",2022arXiv220505706T,arXiv e-prints,1
328,2022,2022-05-01 00:00:00+00:00,"Identification of SRGt 062340.2-265751 as a bright, strongly variable, novalike cataclysmic variable","Schwope, A",2022A&A...661A..42S,Astronomy and Astrophysics,4
329,2022,2022-04-01 00:00:00+00:00,The Refined Transit Ephemeris of TOI-2180 b,"Dalba, P",2022RNAAS...6...76D,Research Notes of the American Astronomical Society,1
330,2022,2022-04-01 00:00:00+00:00,"Orbital alignment of HD 332231 b. The warm Saturn HD 332231 b/TOI-1456 b travels on a well-aligned, circular orbit around a bright F8 dwarf","Knudstrup, E",2022A&A...660A..99K,Astronomy and Astrophysics,5
331,2022,2022-04-01 00:00:00+00:00,X-Ray Emission from Candidate Stellar Merger Remnant TYC 2597-735-1 and Its Blue Ring Nebula,"Gunther, H",2022AJ....163..173G,The Astronomical Journal,0
332,2022,2022-04-01 00:00:00+00:00,The LHS 1678 System: Two Earth-sized Transiting Planets and an Astrometric Companion Orbiting an M Dwarf Near the Convective Boundary at 20 pc,"Silverstein, M",2022AJ....163..151S,The Astronomical Journal,5
333,2022,2022-04-01 00:00:00+00:00,Measuring Frequency and Period Separations in Red-giant Stars Using Machine Learning,"Dhanpal, S",2022ApJ...928..188D,The Astrophysical Journal,1
334,2022,2022-04-01 00:00:00+00:00,Gravity darkening and tidally perturbed stellar pulsation in the misaligned exoplanet system WASP-33,"Kalman, S",2022A&A...660L...2K,Astronomy and Astrophysics,3
335,2022,2022-04-01 00:00:00+00:00,Five young δ Scuti stars in the Pleiades seen with Kepler/K2,"Murphy, S",2022MNRAS.511.5718M,Monthly Notices of the Royal Astronomical Society,14
336,2022,2022-04-01 00:00:00+00:00,Apsidal motion in massive eccentric binaries in NGC 6231. The case of HD 152219,"Rosu, S",2022A&A...660A.120R,Astronomy and Astrophysics,5
337,2022,2022-04-01 00:00:00+00:00,HAZMAT. VIII. A Spectroscopic Analysis of the Ultraviolet Evolution of K Stars: Additional Evidence for K Dwarf Rotational Stalling in the First Gigayear,"Richey-Yowell, T",2022ApJ...929..169R,The Astrophysical Journal,6
338,2022,2022-04-01 00:00:00+00:00,Reassessing the Evidence for Time Variability in the Atmosphere of the Exoplanet HAT-P-7 b<SUB>f</SUB>,"Lally, M",2022AJ....163..181L,The Astronomical Journal,7
339,2022,2022-04-01 00:00:00+00:00,New exocomets of β Pic,"Pavlenko, Y",2022A&A...660A..49P,Astronomy and Astrophysics,7
340,2022,2022-04-01 00:00:00+00:00,TESS Transit Timing of Hundreds of Hot Jupiters,"Ivshina, E",2022ApJS..259...62I,The Astrophysical Journal Supplement Series,19
341,2022,2022-04-01 00:00:00+00:00,Theoretical and Observational Evidence for Coriolis Effects in Coronal Magnetic Fields via Direct Current Driven Flaring Events,"Seligman, D",2022ApJ...929...54S,The Astrophysical Journal,4
342,2022,2022-04-01 00:00:00+00:00,"Flares, Rotation, and Planets of the AU Mic System from TESS Observations","Gilbert, E",2022AJ....163..147G,The Astronomical Journal,32
343,2022,2022-04-01 00:00:00+00:00,The puzzling story of flare inactive ultra fast rotating M dwarfs. II. Searching for radial velocity variations,"Ramsay, G",2022MNRAS.511.2755R,Monthly Notices of the Royal Astronomical Society,3
344,2022,2022-04-01 00:00:00+00:00,Ninety-seven Eclipsing Quadruple Star Candidates Discovered in TESS Full-frame Images,"Kostov, V",2022ApJS..259...66K,The Astrophysical Journal Supplement Series,11
345,2022,2022-04-01 00:00:00+00:00,Parameters of the eclipsing binary α Draconis observed by TESS and SONG,"Hey, D",2022MNRAS.511.2648H,Monthly Notices of the Royal Astronomical Society,1
346,2022,2022-04-01 00:00:00+00:00,Evidence that the Hot Jupiter WASP-77 A b Formed Beyond Its Parent Protoplanetary Disk's H2O Ice Line,"Reggiani, H",2022AJ....163..159R,The Astronomical Journal,12
347,2022,2022-03-01 00:00:00+00:00,TOI-530b: a giant planet transiting an M-dwarf detected by TESS,"Gan, T",2022MNRAS.511...83G,Monthly Notices of the Royal Astronomical Society,16
348,2022,2022-03-01 00:00:00+00:00,Revealing the Field Sub-subgiant Population Using a Catalog of Active Giant Stars and Gaia EDR3,"Leiner, E",2022ApJ...927..222L,The Astrophysical Journal,7
349,2022,2022-03-01 00:00:00+00:00,"Discovery and mass measurement of the hot, transiting, Earth-sized planet, GJ 3929 b","Kemmer, J",2022A&A...659A..17K,Astronomy and Astrophysics,7
350,2022,2022-03-01 00:00:00+00:00,Gaia 0007-1605: An Old Triple System with an Inner Brown Dwarf-White Dwarf Binary and an Outer White Dwarf Companion,"Rebassa-Mansergas, A",2022ApJ...927L..31R,The Astrophysical Journal,3
351,2022,2022-03-01 00:00:00+00:00,Astrometric Precision Tests on TESS Data,"Gai, M",2022PASP..134c5004G,Publications of the Astronomical Society of the Pacific,3
352,2022,2022-03-01 00:00:00+00:00,"HATS-74Ab, HATS-75b, HATS-76b, and HATS-77b: Four Transiting Giant Planets Around K and M Dwarfs","Jordan, A",2022AJ....163..125J,The Astronomical Journal,15
353,2022,2022-03-01 00:00:00+00:00,On the parameter refinement of inflated exoplanets with large radius uncertainty based on TESS observations,"Alexoudi, X",2022AN....34324012A,Astronomische Nachrichten,4
354,2022,2022-03-01 00:00:00+00:00,TESS Giants Transiting Giants. II. The Hottest Jupiters Orbiting Evolved Stars,"Grunblatt, S",2022AJ....163..120G,The Astronomical Journal,12
355,2022,2022-03-01 00:00:00+00:00,Searching for TESS Photometric Variability of Possible JWST Spectrophotometric Standard Stars,"Mullally, S",2022AJ....163..136M,The Astronomical Journal,6
356,2022,2022-03-01 00:00:00+00:00,The first study of four doubly eclipsing systems,"Zasche, P",2022A&A...659A...8Z,Astronomy and Astrophysics,2
357,2022,2022-03-01 00:00:00+00:00,Recovery of TESS Stellar Rotation Periods Using Deep Learning,"Claytor, Z",2022ApJ...927..219C,The Astrophysical Journal,15
358,2022,2022-02-01 00:00:00+00:00,A Matched Survey for the Enigmatic Low Radio Frequency Transient ILT J225347+862146,"Huang, Y",2022ApJ...925..171H,The Astrophysical Journal,0
359,2022,2022-02-01 00:00:00+00:00,Kepler-167e as a Probe of the Formation Histories of Cold Giants with Inner Super-Earths,"Chachan, Y",2022ApJ...926...62C,The Astrophysical Journal,11
360,2022,2022-02-01 00:00:00+00:00,"Triply eclipsing triple stars in the northern TESS fields: TICs 193993801, 388459317, and 52041148","Borkovits, T",2022MNRAS.510.1352B,Monthly Notices of the Royal Astronomical Society,15
361,2022,2022-02-01 00:00:00+00:00,The CubeSpec space mission. I. Asteroseismology of massive stars from time-series optical spectroscopy: Science requirements and target list prioritisation,"Bowman, D",2022A&A...658A..96B,Astronomy and Astrophysics,11
362,2022,2022-02-01 00:00:00+00:00,A 20 Second Cadence View of Solar-type Stars and Their Planets with TESS: Asteroseismology of Solar Analogs and a Recharacterization of π Men c,"Huber, D",2022AJ....163...79H,The Astronomical Journal,21
363,2022,2022-02-01 00:00:00+00:00,TESS Giants Transiting Giants. I.: A Noninflated Hot Jupiter Orbiting a Massive Subgiant,"Saunders, N",2022AJ....163...53S,The Astronomical Journal,10
364,2022,2022-02-01 00:00:00+00:00,"A 2+1 + 1 quadruple star system containing the most eccentric, low-mass, short-period, eclipsing binary known","Han, E",2022MNRAS.510.2448H,Monthly Notices of the Royal Astronomical Society,1
365,2022,2022-02-01 00:00:00+00:00,The Kepler IRIS Catalog: Image Subtraction Light Curves for 9150 Stars in and around the Open Clusters NGC 6791 and NGC 6819,"Colman, I",2022ApJS..258...39C,The Astrophysical Journal Supplement Series,4
366,2022,2022-02-01 00:00:00+00:00,Chemo-dynamics and asteroseismic ages of seven metal-poor red giants from the Kepler field,"Alencastro Puls, A",2022MNRAS.510.1733A,Monthly Notices of the Royal Astronomical Society,3
367,2022,2022-02-01 00:00:00+00:00,Kepler Bonus: Aperture Photometry Light Curves of EXBA Sources,"Martinez-Palomera, J",2022AJ....163...93M,The Astronomical Journal,1
368,2022,2022-02-01 00:00:00+00:00,Dynamical Mass of the Young Substellar Companion HD 984 B,"Franson, K",2022AJ....163...50F,The Astronomical Journal,16
369,2022,2022-02-01 00:00:00+00:00,Velocity monitoring of γ Cas stars reveals their binarity status,"Naze, Y",2022MNRAS.510.2286N,Monthly Notices of the Royal Astronomical Society,13
370,2022,2022-02-01 00:00:00+00:00,The TESS-Keck Survey. VIII. Confirmation of a Transiting Giant Planet on an Eccentric 261 Day Orbit with the Automated Planet Finder Telescope,"Dalba, P",2022AJ....163...61D,The Astronomical Journal,11
371,2022,2022-02-01 00:00:00+00:00,Validation of 13 Hot and Potentially Terrestrial TESS Planets,"Giacalone, S",2022AJ....163...99G,The Astronomical Journal,5
372,2022,2022-02-01 00:00:00+00:00,"Kepler binary stars in NGC 6791 open cluster: KIC 2437060, KIC 2437149, and KIC 2438490","Cakirli, O",2022MNRAS.509.5511C,Monthly Notices of the Royal Astronomical Society,0
373,2022,2022-02-01 00:00:00+00:00,"Efficient and Precise Transit Light Curves for Rapidly Rotating, Oblate Stars","Dholakia, S",2022ApJ...925..185D,The Astrophysical Journal,6
374,2022,2022-01-01 00:00:00+00:00,CORALIE radial-velocity search for companions around evolved stars (CASCADES). III. A new Jupiter host-star: in-depth analysis of HD 29399 using TESS data,"Pezzotti, C",2022A&A...657A..89P,Astronomy and Astrophysics,2
375,2022,2022-01-01 00:00:00+00:00,Discovery of an inflated hot Jupiter around a slightly evolved star TOI-1789,"Khandelwal, A",2022MNRAS.509.3339K,Monthly Notices of the Royal Astronomical Society,5
376,2022,2022-01-01 00:00:00+00:00,Discovery of the most luminous quasar of the last 9 Gyr,"Onken, C",2022PASA...39...37O,Publications of the Astronomical Society of Australia,3
377,2022,2022-01-01 00:00:00+00:00,"TIC 257060897b: An inflated, low-density, hot-Jupiter transiting a rapidly evolving subgiant star","Montalto, M",2022MNRAS.509.2908M,Monthly Notices of the Royal Astronomical Society,3
378,2022,2022-01-01 00:00:00+00:00,Rapid Bursts of Magnetically Gated Accretion in the Intermediate Polar V1025 Cen,"Littlefield, C",2022ApJ...924L...8L,The Astrophysical Journal,5
379,2022,2022-01-01 00:00:00+00:00,Comparative Analysis of Observations of the Selected Exoplanet Transits Obtained at the Kyiv Comet Station with the Database of the Orbital Telescopes Tess and Kepler,"Lobodenko, M",2022OAP....35...44L,Odessa Astronomical Publications,0
380,2022,2022-01-01 00:00:00+00:00,Searching for Diamagnetic Blob Accretion in the 74 day K2 Observation of V2400 Ophiuchi,"Langford, A",2022AJ....163....4L,The Astronomical Journal,1
381,2022,2022-01-01 00:00:00+00:00,"AltaiPony: Flare finder for Kepler, K2, and TESS light curves","Ilin, E",2022ascl.soft01009I,Astrophysics Source Code Library,0
382,2022,2022-01-01 00:00:00+00:00,CORALIE radial velocity search for companions around evolved stars (CASCADES). II. Seismic masses for three red giants orbited by long-period massive planets,"Buldgen, G",2022A&A...657A..88B,Astronomy and Astrophysics,2
383,2022,2022-01-01 00:00:00+00:00,The ultra-hot-Jupiter KELT-16 b: dynamical evolution and atmospheric properties,"Mancini, L",2022MNRAS.509.1447M,Monthly Notices of the Royal Astronomical Society,5
384,2022,2022-01-01 00:00:00+00:00,Automated Extended Aperture Photometry of K2 Variable Stars,"Bodi, A",2022PASP..134a4503B,Publications of the Astronomical Society of the Pacific,4
385,2022,2022-01-01 00:00:00+00:00,"The K2-OjOS Project: New and revisited planets and candidates in K2 campaigns 5, 16, &amp; 18","Castro-Gonzalez, A",2022MNRAS.509.1075C,Monthly Notices of the Royal Astronomical Society,5
386,2022,2022-01-01 00:00:00+00:00,Identify Light-curve Signals with Deep Learning Based Object Detection Algorithm. I. Transit Detection,"Cui, K",2022AJ....163...23C,The Astronomical Journal,4
387,2022,2022-01-01 00:00:00+00:00,Evidence for Centrifugal Breakout around the Young M Dwarf TIC 234284556,"Palumbo, E",2022ApJ...925...75P,The Astrophysical Journal,5
388,2022,2022-01-01 00:00:00+00:00,"V1298 Tau with TESS: Updated Ephemerides, Radii, and Period Constraints from a Second Transit of V1298 Tau e","Feinstein, A",2022ApJ...925L...2F,The Astrophysical Journal,9
389,2022,2022-01-01 00:00:00+00:00,TESS Eclipsing Binary Stars. I. Short-cadence Observations of 4584 Eclipsing Binaries in Sectors 1-26,"Prsa, A",2022ApJS..258...16P,The Astrophysical Journal Supplement Series,44
390,2022,2022-01-01 00:00:00+00:00,V606 Cen: A Newly Formed Massive Contact Binary in a Hierarchical Triple System,"Li, F",2022ApJ...924...30L,The Astrophysical Journal,8
391,2022,2022-01-01 00:00:00+00:00,Observationally Constraining the Starspot Properties of Magnetically Active M67 Sub-subgiant S1063,"Gosnell, N",2022ApJ...925....5G,The Astrophysical Journal,8
392,2022,2022-01-01 00:00:00+00:00,Two newly identified eclipsing binaries in open cluster NGC 3532,"Ozdarcan, O",2022MNRAS.509.1912O,Monthly Notices of the Royal Astronomical Society,0
393,2022,2022-01-01 00:00:00+00:00,"First Results on RR Lyrae Stars with the TESS Space Telescope: Untangling the Connections between Mode Content, Colors, and Distances","Molnar, L",2022ApJS..258....8M,The Astrophysical Journal Supplement Series,15
394,2022,2022-01-01 00:00:00+00:00,A Study of the Stochastic Photometric Variability in the Winds of Galactic Wolf-Rayet Stars,"Lenoir-Craig, G",2022ApJ...925...79L,The Astrophysical Journal,6
395,2022,2022-01-01 00:00:00+00:00,Escape from the Bermuda cluster: Orphanization by multiple stellar ejections,"Maiz Apellaniz, J",2022A&A...657A..72M,Astronomy and Astrophysics,6
396,2021,2021-12-01 00:00:00+00:00,"Stellar Spins in the Pleiades, Praesepe, and M35 Open Clusters","Healy, B",2021ApJ...923...23H,The Astrophysical Journal,9
397,2021,2021-12-01 00:00:00+00:00,A Uniform Search for Nearby Planetary Companions to Hot Jupiters in TESS Data Reveals Hot Jupiters Are Still Lonely,"Hord, B",2021AJ....162..263H,The Astronomical Journal,16
398,2021,2021-12-01 00:00:00+00:00,TACOS: TESS AM CVn Outbursts Survey,"Pichardo Marcano, M",2021MNRAS.508.3275P,Monthly Notices of the Royal Astronomical Society,8
399,2021,2021-12-01 00:00:00+00:00,Photometric Monitoring and Period Changes in SX Phoenicis Star XX Cygni. IV.,"Withers, S",2021JRASC.115..238W,Journal of the Royal Astronomical Society of Canada,0
